{
  "schema_version": "2",
  "part_id": "P01",
  "wall_id": "box",
  "T_LP": [
    [
      1.0,
      0.0,
      0.0,
      0.0
    ],
    [
      0.0,
      1.0,
      0.0,
      0.0
    ],
    [
      0.0,
      0.0,
      1.0,
      0.0
    ],
    [
      0.0,
      0.0,
      0.0,
      1.0
    ]
  ],
  "T_SP": [
    [
      1.0,
      0.0,
      0.0,
      0.0
    ],
    [
      0.0,
      1.0,
      0.0,
      0.0
    ],
    [
      0.0,
      0.0,
      1.0,
      0.0
    ],
    [
      0.0,
      0.0,
      0.0,
      1.0
    ]
  ],
  "T_WP": [
    [
      1.0,
      0.0,
      0.0,
      780.0
    ],
    [
      0.0,
      1.0,
      0.0,
      605.0
    ],
    [
      0.0,
      0.0,
      1.0,
      901.0
    ],
    [
      0.0,
      0.0,
      0.0,
      1.0
    ]
  ],
  "placement": {
    "x_mm": 0.0,
    "y_mm": 0.0,
    "yaw_deg": 0.0
  },
  "bbox_P": {
    "min": [
      -300.0,
      -100.0,
      0.0
    ],
    "max": [
      300.0,
      100.0,
      40.0
    ]
  },
  "volume_mm3": 4800000.0,
  "n_layers": 4,
  "status": "nicht machbar",
  "cause": {
    "sample": 270,
    "t_s": 76.5096,
    "link": "tool_body",
    "obstacle": "printed",
    "message": "Fixture: Werkzeugkoerper durchdringt den gedruckten Teil (3,5 mm), nicht geprueft."
  }
}
